{"ticket":"UI-001","round":1,"reviewer":"ponytail-reviewer","verdict":"approve","stage1":"pass",
"findings":[
{"file":"tests/test_report_html.py","line":38,"severity":"minor","source":"acceptance","issue":"test_no_secret_values only runs generic regexes; it never checks the real .env.test email/username/password or a planted secret, so it would not catch a leak of those values.","fix_hint":"Add a test that injects a known secret string into a report field and asserts redaction upstream, or that greps the HTML for values loaded from .env.test when present."},
{"file":"authagent/report_html.py","line":71,"severity":"minor","source":"security","issue":"Screenshots are inlined as base64 (3MB HTML); pixels of authenticated pages (username_visible=true) cannot be grepped for leaks. Text fields are clean.","fix_hint":"Acceptable; note for the final audit. Optionally link rather than embed."},
{"file":"authagent/report_html.py","line":105,"severity":"minor","source":"ponytail-review","issue":"Links use only the file basename, which works only because report.html sits in the run folder with the artifacts; breaks if report.html is moved.","fix_hint":"Document that report.html must stay beside the artifacts."}],
"criteria_met":["Single self-contained HTML with timeline, routes table, screenshots, auth-HTML links, per-step pass/fail, failure banner, PASSED/FAILED","No secrets in produced HTML (grepped .env.test email, username, password: clean; no tokens/cookies/JWT)","Opens from disk: inline CSS, no external src/href, only a plain-text localhost URL","All values escaped via html.escape; script injection test passes","CLI: --help and run --help intact, report subcommand added; 105 tests pass incl. 5 report tests"],
"criteria_missed":[],
"notes":"Keys rendered are only those in real report.json; optional fields degrade. Used direct review of committed files; ponytail-review not separately invoked, manual multi-axis review done."}
