{"ticket":"DEV-006","round":1,"reviewer":"ponytail-reviewer","verdict":"approve","stage1":"pass",
"findings":[
{"file":"authagent/run.py","line":75,"severity":"minor","source":"ponytail-review","issue":"If the email step is skipped AND a later step genuinely fails, status/exit become skipped_email (3) instead of failed (1), masking a real failure. In practice the email step stops the chain so low risk.","fix_hint":"Compute failed first: code=1 if any step not pass; else 3 if skipped."},
{"file":"runs/e2e-localhost_8889.json","severity":"minor","source":"acceptance","issue":"Stale legacy file from before the fix still fails json.load (gitignored, regenerated by next --e2e).","fix_hint":"Delete or re-run --e2e."}],
"criteria_met":["run subcommand pipeline","per-run report.json with timeline, routes, artifacts, failure reasons","no secrets in report/stdout (json.load + grep of .env.test email/password/username in 3 sample reports: none found)","exit codes 0/1/2/3 (example.com -> 2 verified; live pass 0 per sample reports)","CLI contract python -m authagent run --url <site> exact; --check-url/--e2e/--crawl/--signup retained","invalid-JSON fix: redact_obj walks values only; json.load test exists and meaningful","pytest 105 passed"],
"criteria_missed":[],
"notes":"Ponytail installed not separately invoked; manual review of run.py/secrets.py/tests. Allowlist refusal prints 'refused: host ... not on the allowlist', exit 2, no traceback, report written with status refused."}
