{"ticket":"DEV-003","round":2,"reviewer":"ponytail-reviewer","verdict":"approve","stage1":"pass",
"findings":[
{"file":"authagent/fill.py","line":138,"severity":"minor","source":"ponytail-review","issue":"With a pathological maxlength under 4 not all complexity classes fit (e.g. hi=4 gives 'a!1A' only because need is 4 long; hi<4 drops some). Unrealistic; below the 8 minimum anyway.","fix_hint":"None needed."}
],
"criteria_met":[
"Round-1 major (a): maxlength=6 yields 6 chars with a digit; maxlength=10 keeps digit and length 10 (verified by running make_password)",
"(b): lo=200 is capped at 128 (verified)",
"(c): no_symbol strips non-alphanumerics, result isalnum (verified)",
"(d): sanitize_username('Ab-C') -> 'abc' padded to >=3; used for env-loaded usernames in gen_value (verified)",
"Minors: required radio/checkbox/text fields filled; error regexes use word boundaries; regen skipped when message scope is password",
"pytest 65 passed (re-run by reviewer)"],
"criteria_missed":[],
"notes":"Scope limited to re-checking round-1 findings. Live criterion remains waived per Orchestrator."}
